{
  "$schema": "https://json-schema.org/draft/2020-12/schema",
  "title": "Shipwright normalized ticket",
  "description": "Written by /intake to .delivery/<id>/ticket.json. Missing information goes in open_questions, never guessed.",
  "type": "object",
  "additionalProperties": false,
  "required": ["id", "source", "flow", "type", "title", "description", "acceptance_criteria", "open_questions"],
  "properties": {
    "id": { "type": "string", "pattern": "^(?!.*\\.\\.)[A-Za-z0-9](?:[A-Za-z0-9._-]{0,62}[A-Za-z0-9_-])?$" },
    "source": { "enum": ["jira", "linear", "azure-devops", "github", "form", "text"] },
    "source_url": { "type": "string", "minLength": 1 },
    "flow": { "enum": ["task", "app"] },
    "type": { "enum": ["feature", "bug", "refactor", "chore"] },
    "repo": { "type": "string", "minLength": 1 },
    "base_branch": { "type": "string", "minLength": 1 },
    "title": { "type": "string", "minLength": 1 },
    "description": { "type": "string" },
    "acceptance_criteria": { "type": "array", "items": { "type": "string", "minLength": 1 } },
    "reproduction_steps": { "type": "array", "items": { "type": "string", "minLength": 1 } },
    "links": { "type": "array", "items": { "type": "string", "minLength": 1 } },
    "constraints": { "type": "array", "items": { "type": "string", "minLength": 1 } },
    "deploy": {
      "type": "object",
      "additionalProperties": false,
      "required": ["target", "env"],
      "properties": {
        "target": { "type": "string", "pattern": "^[a-z0-9][a-z0-9-]*$" },
        "env": { "type": "string", "minLength": 1 }
      }
    },
    "open_questions": { "type": "array", "items": { "type": "string", "minLength": 1 } }
  }
}
